{
  "title": "The disc launcher: the body on its optimised frame with the bow at full draw, the sled, the magazine insert, a disc at the mouth, and the lid",
  "kind": "fit",
  "uses": [
    "launcher",
    "x1c"
  ],
  "items": [
    {
      "id": "body",
      "object": "body:drawn"
    },
    {
      "id": "sled",
      "object": "sled"
    },
    {
      "id": "magazine",
      "object": "magazine:full"
    },
    {
      "id": "disc",
      "object": "disc"
    },
    {
      "id": "lid",
      "object": "lid"
    }
  ],
  "joints": [
    {
      "id": "run",
      "type": "prismatic",
      "parent": "body.rest",
      "child": "sled.drive",
      "min": "x1c.fit - (launcher.travel + launcher.overrun)",
      "max": 0,
      "label": "The sled along the slot"
    },
    {
      "id": "cap",
      "type": "fixed",
      "parent": "body.column",
      "child": "magazine.seat",
      "label": "The insert pressed home in the column"
    },
    {
      "id": "drop",
      "type": "prismatic",
      "parent": "body.mouth",
      "child": {
        "item": "disc",
        "at": [
          0,
          0,
          0
        ],
        "axis": [
          0,
          0,
          1
        ]
      },
      "min": 0,
      "max": "sled.thickness / 2 + launcher.disc_t / 2",
      "label": "The bottom disc: in the slot when the sled is back, on the sled's plate when it's forward"
    },
    {
      "id": "cover",
      "type": "fixed",
      "parent": "body.lid",
      "child": "lid.seat",
      "label": "The lid on the body"
    }
  ],
  "poses": {
    "cocked": {
      "run": "x1c.fit - (launcher.travel + launcher.overrun)",
      "drop": 0
    },
    "rest": {
      "run": 0,
      "drop": "sled.thickness / 2 + launcher.disc_t / 2"
    }
  },
  "fits": [
    {
      "a": "sled",
      "b": "body",
      "min": 0,
      "max": "x1c.fit",
      "note": "The sled slides in the slot"
    },
    {
      "a": "magazine",
      "b": "body",
      "min": 0,
      "max": "2 * x1c.fit",
      "note": "The insert in its column"
    },
    {
      "a": "lid",
      "b": "body",
      "min": "0 - 1",
      "max": "x1c.fit",
      "note": "The lid's pins snap into the sockets: their barbs overlap the holes"
    }
  ]
}
